story,location,characters
"Deep within the enchanted forest of Ellowyn, where the trees whispered ancient secrets and the brook sang to the moon, young Elara stumbled upon a hidden glade bathed in golden light. The air was thick with the scent of blooming nightshade, and the soft trills of creatures unseen mingled with the rustle of leaves. As Elara explored, she met Mirin, a wise old sprite with eyes like twin emeralds and wings that shimmered like a thousand rainbows. Together, they uncovered the forgotten ruins of an ancient empire, long lost to time, and awakened the gentle spirit of Arion, the last guardian of the forest. With the first light of dawn, Elara and her newfound friends vowed to protect the magic of Ellowyn from the encroaching shadows of the outside world.",Enchanted forest of Ellowyn,"['Elara', 'Mirin', 'Arion']"
"In the heart of the enchanted forest of Alveron, the wise old owl named Elara watched over the land from her perch atop the ancient oak tree. She had seen the forest come to life with the magic of spring, witnessed the creatures dancing under the shimmering moonlight, and listened to the whispers of the trees that held secrets of ages long past. One day, a curious fox named Finn, with his fiery red fur and twinkling eyes, ventured near Elara's tree, seeking knowledge about the mysterious melody that echoed through the woods. Elara, with her deep, soothing voice, shared tales of enchanted rivers and the guardian spirits that protected the forest, captivating Finn with wonders he had never imagined. As the sun dipped below the horizon, casting golden hues across the sky, Elara and Finn formed an unlikely friendship, bound by the enchanting stories of the forest of Alveron.",Enchanted Forest of Alveron,"['Elara', 'Finn']"
"In the tiny coastal village of Marlin Bay, nestled where the forest met the sea, Amelia, an aspiring marine biologist, discovered a secret underwater cave teeming with bioluminescent creatures. Her heart raced as she explored this hidden world, documenting her findings with the help of Oliver, a seasoned diver. Together, they marveled at the vibrant colors and the gentle glow illuminating the cave walls, a discovery they hoped would inspire others to appreciate the delicate beauty of ocean life. Yet, as they surfaced, they worried about the cave's fate, knowing all too well the challenges of protecting such wonders from human intrusion.",Marlin Bay,"['Amelia', 'Oliver']"
"In the heart of the Enchanted Forest, where the sunlight filtered through the dense canopy creating a dance of light and shadow, there dwelled a wise old owl named Orin. Orin had watched over the forest for more than a century, his keen eyes observing the changes of seasons and the lives of the forest's inhabitants. One day, a young fox named Felix, with a coat as fiery as the autumn leaves, approached Orin, seeking wisdom. ""Orin,"" Felix asked timidly, ""how do I find the courage to venture beyond the forest?"" Orin, spreading his great wings, replied, ""Courage, dear Felix, is not the absence of fear, but the recognition that something else is more important. Look to the sky and remember that even the tallest trees begin as seeds."" Encouraged by Orin's words, Felix set off on his journey, the whisper of the leaves and the hoot of the owl guiding him into the great unknown.",Enchanted Forest,"['Orin', 'Felix']"
"In the heart of the enchanted forest of Elderglen, young Alara stumbled upon a shimmering pool that whispered secrets of the past. She knelt beside the water's edge, where the reflection of the moon unveiled the ghostly figure of Seraphina, the last of the forest's guardians, who had vowed to protect the grove until a worthy heir arrived. With a gentle touch of her hand on the water, Alara found herself transported into Seraphina's realm, a dreamscape where the ancient trees told stories and the stars danced in spirals across the sky. As the night deepened, the air grew still, and the trees murmured Alara's name, bestowing upon her the mantle of the guardian, to carry the light of Elderglen into the future.",Elderglen forest,"['Alara', 'Seraphina']"
