question,answer,story
Zylka sang a melody that made the flowers bloom.,True,"In a hidden valley between misty mountains, there lived a peculiar creature named Zylka. Zylka had the body of a rabbit, the wings of a butterfly, and the wisdom of an owl. Every full moon, Zylka would sing a haunting melody that echoed through the valley and enchanted all who heard it, causing the flowers to bloom even in the coldest months. One day, a young girl named Mira stumbled into the valley and heard Zylka's song. Entranced by the music, she followed it to a glade where she found Zylka perched on a stone, surrounded by a circle of luminous flowers. Zylka welcomed Mira with a gentle nod and together they shared stories until the sun rose, forging a friendship that would last for years."
Mira was a young boy who found Zylka.,False,"In a hidden valley between misty mountains, there lived a peculiar creature named Zylka. Zylka had the body of a rabbit, the wings of a butterfly, and the wisdom of an owl. Every full moon, Zylka would sing a haunting melody that echoed through the valley and enchanted all who heard it, causing the flowers to bloom even in the coldest months. One day, a young girl named Mira stumbled into the valley and heard Zylka's song. Entranced by the music, she followed it to a glade where she found Zylka perched on a stone, surrounded by a circle of luminous flowers. Zylka welcomed Mira with a gentle nod and together they shared stories until the sun rose, forging a friendship that would last for years."
Zylka had the wings of a butterfly.,True,"In a hidden valley between misty mountains, there lived a peculiar creature named Zylka. Zylka had the body of a rabbit, the wings of a butterfly, and the wisdom of an owl. Every full moon, Zylka would sing a haunting melody that echoed through the valley and enchanted all who heard it, causing the flowers to bloom even in the coldest months. One day, a young girl named Mira stumbled into the valley and heard Zylka's song. Entranced by the music, she followed it to a glade where she found Zylka perched on a stone, surrounded by a circle of luminous flowers. Zylka welcomed Mira with a gentle nod and together they shared stories until the sun rose, forging a friendship that would last for years."
Did Elsbeth create an enchanted device to capture the light of a sunrise?,False,"In a mystical village hidden deep within the Whispering Woods, there lived a kind but peculiar inventor named Elsbeth. She spent her days crafting enchanted devices that brought warmth and joy to her neighbors. One chilly autumn morning, Elsbeth decided to create a magical lamp that could capture the light of a sunset and bring it into any room. With careful adjustments of gears and a sprinkle of star dust, she finally succeeded. The whole village gathered to witness the unveiling, and as the lamp glowed with the golden hues of a sunset, cheers filled the air. The villagers were so enchanted by this creation that they declared the day of its unveiling a new holiday, celebrating it annually with a festival of lights and laughter."
Did the villagers declare a new holiday because of Elsbeth's invention?,True,"In a mystical village hidden deep within the Whispering Woods, there lived a kind but peculiar inventor named Elsbeth. She spent her days crafting enchanted devices that brought warmth and joy to her neighbors. One chilly autumn morning, Elsbeth decided to create a magical lamp that could capture the light of a sunset and bring it into any room. With careful adjustments of gears and a sprinkle of star dust, she finally succeeded. The whole village gathered to witness the unveiling, and as the lamp glowed with the golden hues of a sunset, cheers filled the air. The villagers were so enchanted by this creation that they declared the day of its unveiling a new holiday, celebrating it annually with a festival of lights and laughter."
Was the enchanted device made by Elsbeth a magical lamp?,True,"In a mystical village hidden deep within the Whispering Woods, there lived a kind but peculiar inventor named Elsbeth. She spent her days crafting enchanted devices that brought warmth and joy to her neighbors. One chilly autumn morning, Elsbeth decided to create a magical lamp that could capture the light of a sunset and bring it into any room. With careful adjustments of gears and a sprinkle of star dust, she finally succeeded. The whole village gathered to witness the unveiling, and as the lamp glowed with the golden hues of a sunset, cheers filled the air. The villagers were so enchanted by this creation that they declared the day of its unveiling a new holiday, celebrating it annually with a festival of lights and laughter."
The story takes place in the village of Nymros.,True,"In the enchanted village of Nymros, there was a peculiar bakery run by an ancient turtle named Master Turtelini. This was no ordinary bakery; every loaf of bread was magically infused with the essence of dreams. Villagers from far and wide would come to taste the Dream Loaves, which imbued them with visions of their deepest desires or forgotten memories. One day, a mysterious traveler arrived and asked for a special loaf that could reveal the future. Master Turtelini, with a wise smile, explained that the future was not theirs to see, only dreams and memories. The traveler, understanding, purchased a loaf anyway and left contented, a mysterious glint in their eye."
Master Turtelini was a wise old tortoise.,False,"In the enchanted village of Nymros, there was a peculiar bakery run by an ancient turtle named Master Turtelini. This was no ordinary bakery; every loaf of bread was magically infused with the essence of dreams. Villagers from far and wide would come to taste the Dream Loaves, which imbued them with visions of their deepest desires or forgotten memories. One day, a mysterious traveler arrived and asked for a special loaf that could reveal the future. Master Turtelini, with a wise smile, explained that the future was not theirs to see, only dreams and memories. The traveler, understanding, purchased a loaf anyway and left contented, a mysterious glint in their eye."
The mysterious traveler wanted a Dream Loaf that could reveal the past.,False,"In the enchanted village of Nymros, there was a peculiar bakery run by an ancient turtle named Master Turtelini. This was no ordinary bakery; every loaf of bread was magically infused with the essence of dreams. Villagers from far and wide would come to taste the Dream Loaves, which imbued them with visions of their deepest desires or forgotten memories. One day, a mysterious traveler arrived and asked for a special loaf that could reveal the future. Master Turtelini, with a wise smile, explained that the future was not theirs to see, only dreams and memories. The traveler, understanding, purchased a loaf anyway and left contented, a mysterious glint in their eye."
The Luminafox is known for its enchanting ability to scare travelers away.,False,"In the heart of the Misty Forest, a peculiar creature known as a Luminafox roamed the shadows. With fur like woven moonlight, it shimmered gently as it moved. The Luminafox was known to the villagers for its enchanting ability to guide lost travelers to safety, using the soft glow emanating from its tail. Many had sought its help during foggy nights, and tales of its kindness were whispered in the tavern by the hearth. However, few had ever seen its den, a place of legend said to be nestled beneath the roots of the oldest tree in the forest. It was there, beneath the sprawling branches, that the Luminafox found solace and where no other creature dared to venture."
The Luminafox is said to live beneath the oldest tree in the forest.,True,"In the heart of the Misty Forest, a peculiar creature known as a Luminafox roamed the shadows. With fur like woven moonlight, it shimmered gently as it moved. The Luminafox was known to the villagers for its enchanting ability to guide lost travelers to safety, using the soft glow emanating from its tail. Many had sought its help during foggy nights, and tales of its kindness were whispered in the tavern by the hearth. However, few had ever seen its den, a place of legend said to be nestled beneath the roots of the oldest tree in the forest. It was there, beneath the sprawling branches, that the Luminafox found solace and where no other creature dared to venture."
Many villagers have seen the den of the Luminafox.,False,"In the heart of the Misty Forest, a peculiar creature known as a Luminafox roamed the shadows. With fur like woven moonlight, it shimmered gently as it moved. The Luminafox was known to the villagers for its enchanting ability to guide lost travelers to safety, using the soft glow emanating from its tail. Many had sought its help during foggy nights, and tales of its kindness were whispered in the tavern by the hearth. However, few had ever seen its den, a place of legend said to be nestled beneath the roots of the oldest tree in the forest. It was there, beneath the sprawling branches, that the Luminafox found solace and where no other creature dared to venture."
Is the name of the city where Felix the fox lives Arcanum?,True,"Once upon a time, in the bustling city of Arcanum, a curious little fox named Felix discovered a hidden alleyway behind the old library that led to a secret garden filled with talking flowers. Each flower had a unique story to tell about the history of the city, and Felix, fascinated by their tales, visited them every day. There was a wise sunflower named Solara who knew about the ancient secrets of Arcanum, a playful daisy named Dandy who loved to play tricks on Felix, and a gentle rose named Rosette who sang beautiful songs. Felix promised to keep the garden a secret, but one day, while listening to Rosette's song, a mischievous crow overheard the melody and flew off to tell the world about the magical garden."
Does Felix discover a secret garden behind the old library in the story?,True,"Once upon a time, in the bustling city of Arcanum, a curious little fox named Felix discovered a hidden alleyway behind the old library that led to a secret garden filled with talking flowers. Each flower had a unique story to tell about the history of the city, and Felix, fascinated by their tales, visited them every day. There was a wise sunflower named Solara who knew about the ancient secrets of Arcanum, a playful daisy named Dandy who loved to play tricks on Felix, and a gentle rose named Rosette who sang beautiful songs. Felix promised to keep the garden a secret, but one day, while listening to Rosette's song, a mischievous crow overheard the melody and flew off to tell the world about the magical garden."
Is the sunflower in the secret garden named Solara?,True,"Once upon a time, in the bustling city of Arcanum, a curious little fox named Felix discovered a hidden alleyway behind the old library that led to a secret garden filled with talking flowers. Each flower had a unique story to tell about the history of the city, and Felix, fascinated by their tales, visited them every day. There was a wise sunflower named Solara who knew about the ancient secrets of Arcanum, a playful daisy named Dandy who loved to play tricks on Felix, and a gentle rose named Rosette who sang beautiful songs. Felix promised to keep the garden a secret, but one day, while listening to Rosette's song, a mischievous crow overheard the melody and flew off to tell the world about the magical garden."
